Название,Цена
Диван Льери Мини Velvet Light,64990
Диван Нумо Velvet Yellow,36990
Диван Тут Рядом Дом Серо-графитовый,72990
Диван угловой Эби-1 Velvet Coral,72990
Диван Бонент Velvet Eclipse,74990
Диван Нумо Мини Textile Yellow,24990
Диван Тут Рядом Космос Светло-Бежевый,109990
Диван Линс Velvet Navy Blue,32990
Кресло Тут Рядом Дом Сине-бежевый,50990
Диван угловой Эдвин Velvet Smoke,72990
Диван Бруквиль Velvet Blue,49990
Диван Байма Velvet Grey,69990
Диван Спейс Velvet Beige,62990
Диван угловой Беллер Textile Yellow,40990
Кресло Бенел Cozy Ivory,33990
Диван Нумо Velvet Grafit,36990
Кресло-кровать Маре Мини Velvet Grafit,21990
Диван Клаймар Velvet Beige,56990
Пуф Тут Рядом Дом Серо-графитовый,15990
Диван Марей Soft Grey,89990
Диван Сваут Velvet Grey,64990
Кресло Бенел Cozy Beige,33990
Диван Линс Velvet Grafit,32990
Диван угловой Аронт Мини Velvet Pink,56990
Диван Рейли Velvet Coral,36990
Диван угловой Вайвел Barhat Forest,89990
Диван Бруквиль Velvet Smoke,49990
Пуф Тут Рядом Красавчик Светло-бежевый,34990
Диван Коренс Happy Grey,29990
Диван угловой Шера Velvet Light,99990
Диван Види Textile Ocean,23990
Пуф Тут Рядом Дом Зеленый,15990
Кресло Пайл Barhat Beige,22990
Модульный диван Brera-2 Velour Mix,105980
Кресло Гета Soft Silver,30990
Диван угловой Нумо Velvet Yellow,46990
Модульный диван Нолан-B 3 Soft Jungle,114970
Диван Тут Рядом Дом Сине-бежевый,72990
Кресло Элвит Cozy Ivory,29990
Диван Сваут Velvet Mustard,64990
Кресло Рибс Velvet Beige,26990
Пуф Кропс Bucle Smoky,8990
Пуф Лонди Cozy Beige,11990
Диван Мисл Barhat Mint,74990
Диван угловой Мейлон Velvet Eclipse,49990
Кресло Тут Рядом Дом Розовый,50990
Диван Нумо Мини Textile Light,24990
Диван угловой Бонент Velvet Grey,89990
